date	location	deaths	injuries	description
1999-01-08T05:00:00.000Z	"Carrollton, Georgia"	2	0	"15-year-old Andrea Garrett was found dead and 17-year-old Jeff Miller seriously wounded in the girls' restroom at Central Carrollton County High School, after a suspected suicide pact. Miller died the next day.[294][295]"
1999-04-16T04:00:00.000Z	"Notus, Idaho"	0	0	"15-year-old Shawn Cooper, fired two shots from a shotgun near the front desk at Notus Jr. Sr. High School. There were no serious injuries, but some students were close enough to the blast to be grazed by shrapnel from the tile floor. Cooper had been undergoing treatment for bipolar disorder.[296]"
1999-04-20T04:00:00.000Z	"Littleton, Colorado"	15	21	"Columbine High School massacre: 18-year-old Eric Harris and 17-year-old Dylan Klebold, students at Columbine High School, killed twelve students and one teacher. They injured 21 additional people, and three more were injured while attempting to escape the school. The pair committed suicide in the library after a brief gunfight with police at the end of the massacre. Eric used a 9mm Hi Point Carbine rifle, a Savage 67H pump-action shotgun (double barrel sawed off), multible pipe bombs, propane tanks, gasoline bombs, etc. Dylan used a Intratec TEC-DC9 fully automatic sub machine gun, a stevens 311d double barreled sawed-off shotgun multible pipe bombs, Molotov cocktails, and propane tanks. [287][297]"
1999-05-20T04:00:00.000Z	"Conyers, Georgia"	0	6	"15-year-old student Thomas ""T.J." Solomon Jr., wounded six students at Heritage High School. A 15-year-old girl was hospitalized in critical condition, and the other victims suffered from non-life-threatening injuries.[287] Solomon initially faced up to 351 years of prison if convicted of aggravated assault and other charges. In 2000 he was found guilty but mentally ill and was sentenced to forty years in prison and sixty-five years of probation.[298]"
1999-07-04T04:00:00.000Z	"Bloomington, Indiana"	1	0	"A Korean computer science graduate student attending Indiana University was killed by white supremacist Benjamin Nathaniel Smith, a former Indiana University student, while he was on his way to services at the Korean United Methodist Church near the Indiana University campus
[299]
"
1999-11-19T05:00:00.000Z	"Deming, New Mexico"	1	0	"13-year-old Victor Cordova Jr., fatally shot 13-year-old Deming Middle School schoolmate, Araceli Tena. Cordova said he had intended to commit suicide but was jostled by others and his gun moved.[287][300]"
1999-12-06T05:00:00.000Z	"Fort Gibson, Oklahoma"	0	6	"Before his middle school opened, 13-year-old Seth Trickey opened fire in the courtyard. While there were no fatalities, several students felt sparks from the bullets hitting the building walls. Five were injured, including a girl who was shot in the face.[287] Trickey brought the gun from home.[301]"
2000-02-29T05:00:00.000Z	"Flint, Michigan"	1	0	"Shooting of Kayla Rolland: At Buell Elementary School,
6-year-old Dedrick Owens fatally shot 6-year-old classmate Kayla Rolland. Owens has since been the youngest documented school shooter.[302]
"
2000-05-26T04:00:00.000Z	"Lake Worth, Florida"	1	0	"13-year-old honor student, Nathaniel Brazill, was sent home for throwing water balloons, but returned to his Lake Worth Middle School with a family pistol. He fatally shot teacher Barry Grunow, a popular teacher, he was Brazill's favorite.[302][303]"
2000-06-28T04:00:00.000Z	"Seattle, Washington"	2	0	"58-year-old Director of the Division of Pathology of the University of Washington Medical Center, Rodger C. Haggitt, M. D., was shot dead by 42-year-old Chinese (Taiwan) emigrant and then U. S. citizen, Jian Chen, M. D., who had just completed his second year of forensic pathology residency training and had been notified of his contract non-renewal (which Dr. Chen wrote would dishonor his family).[304] Dr. Haggitt would later be honored with his name upon the History of the Rodger C. Haggitt Gastrointestinal Pathology Society."
2000-08-28T04:00:00.000Z	"Fayetteville, Arkansas"	2	0	"36-year-old James Easton Kelly, a PhD candidate in Comparative Literature at University of Arkansas, killed 67-year-old Dr. John R. Locke, the English professor overseeing his coursework. Kelly had been dismissed from this PhD program for lack of progress toward his degree. Kelly shot Dr. Locke three times before committing suicide in the director's office, which had been isolated by campus police.[305]"
2000-09-26T04:00:00.000Z	"New Orleans, Louisiana"	0	2	"13 year-olds Darrel Johnson, and Alfred Anderson were initially charged with attempted first-degree murder in the shooting of 15 year-old William Pennington. Pennington, after being shot, managed to gain control of the gun and shoot Johnson in the back.[306] Charges were later reduced to Aggravated Battery."
2000-12-01T05:00:00.000Z	"San Diego, California"	0	1	"A 15-year-old Junipero Serra High School student who showed off a handgun on campus and threatened to shoot a classmate, ended up accidentally shooting himself, causing minor injuries.[307]"
2001-03-05T05:00:00.000Z	"Santee, California"	2	13	"Santana High School shooting: 15-year-old student, Charles Andrew Williams, killed two students, 14-year-old Bryan Zuckor, and 15-year-old Randy Gordon, at Santana High School and wounded thirteen others. He was arrested and convicted of murder and attempted murder. He was sentenced to life with the chance of parole after serving fifty years.[308]"
2001-03-07T05:00:00.000Z	"Williamsport, Pennsylvania"	0	1	"14-year-old student, Elizabeth Catherine Bush, wounded fellow student Kimberly Marchese in the cafeteria of Bishop Neumann High School.[309]"
2001-04-02T04:00:00.000Z	"Spring, Texas"	1	0	13 year-old female student committed suicide with a handgun in a bathroom stall at Kleb Intermediate School.[310]
2001-05-16T04:00:00.000Z	"Parkland, Washington"	2	0	40-year-old music instructor and organist James D. Holloway was shot multiple times with a .22-caliber handgun at Pacific Lutheran University by a 55-year-old man from Tacoma. The shooter was not a student or employee of the university and also killed himself. The victim was apparently chosen at random as the shooter had a personal dispute with a different staff member who was not on campus that day.[311]
2001-03-22T05:00:00.000Z	"El Cajon, California"	0	5	"18-year-old former student, Jason Hoffman, opened fire at Granite Hills High School, injuring five people. He was convicted of assault and sentenced to prison, where he committed suicide in 2002.[312]"
2001-03-30T05:00:00.000Z	"Gary, Indiana"	1	0	"17-year-old Donald Ray Burt Jr., fatally shot Neal Boyd, IV with one bullet to the head in a parking lot outside Lew Wallace High School.[313]"
2002-01-15T05:00:00.000Z	"New York City, New York"	0	2	"17-year-old Vincent Rodriguez, wounded two students at Martin Luther King, Jr. High School in Manhattan, with a semi-automatic pistol. He was retaliating for the victims having harassed his girlfriend. In February 2003, Rodriguez was sentenced to ten years in prison on charges of assault and attempted assault.[314]"
2002-01-16T05:00:00.000Z	"Grundy, Virginia"	3	3	"Appalachian School of Law shooting: Recently dismissed graduate student, 42-year-old Peter Odighizuwa, killed three at the Appalachian School of Law. 42-year-old dean Anthony Sutin, and 41-year-old professor Thomas Blackwell were killed along with 33-year-old student, Angela Dales. Three other students were also wounded.[315] Odighizuwa received three life sentences and an additional 28 years without the possibility of parole until 2005.[316]"
2002-02-20T05:00:00.000Z	"Milwaukee, Wisconsin"	1	0	"16-year-old Washington High School student, Joseph Johnson Jr., was killed by Phillip D. Jackson Jr., when violence erupts between rival fans in the parking lot, after a basketball game between Vincent High School.[317]"
2002-06-11T04:00:00.000Z	"Conception, Missouri"	3	2	"71-year-old Lloyd Robert Jeffress opened fire at random in the halls of Conception Abbey, a monastery in northwest Missouri.
He killed two monks and seriously wounded another two before fatally shooting himself. Two weapons, a Chinese-made replica of the AK-47 and a sawed-off .22-caliber rifle, were found near the body.[318]
"
2002-10-07T04:00:00.000Z	"Bowie, Maryland"	0	1	"In the Beltway sniper attacks, one victim of several was 13-year-old Iran Brown, who was wounded as he arrived at Benjamin Tasker Middle School in Bowie, Maryland. His aunt, a nurse who had just dropped him off, rushed him to a hospital emergency room. Despite serious injuries, Brown survived the attack.[319][320]"
2002-10-28T05:00:00.000Z	"Tucson, Arizona"	4	0	"Failing nursing college student and Gulf War veteran, 40-year-old Robert Stewart Flores Jr., killed three assistant professors of nursing at the University of Arizona, 50-year-old Robin Rogers, 44-year-old Cheryl McGaffic, and 45-year-old Barbara Monroe, before turning the gun on himself.[321]"
2002-10-29T05:00:00.000Z	"Jersey City, New Jersey"	0	1	"A 15-year-old student was shot in the abdomen and wounded inside a basement of Lincoln High School, during an argument with another student. Another 15-year-old student was arrested and charged with attempted murder.[322]"
2003-04-14T04:00:00.000Z	"New Orleans, Louisiana"	1	3	"John McDonogh High School shooting. 18-year-old Steven Williams, and 17-year-old James Tate opened fire with an AK-47 and a handgun in the gymnasium of John McDonogh High School, killing a 15-year-old student and wounding three female students. Williams was sentenced to life imprisonment, and Tate was sentenced to fifteen years.[323][324][325]"
2003-04-24T04:00:00.000Z	"Red Lion, Pennsylvania"	2	0	"14-year-old student James Sheets, entered Red Lion Area Junior High School armed with his stepfather's pistols. He killed the school's principal, Eugene Segro, before killing himself.[326][327]"
2003-05-09T04:00:00.000Z	"Cleveland, Ohio"	1	2	"On May 9, 2003, Biswanath Halder, a 62-year-old business school alumnus of Case Western Reserve University, killed a graduate student and wounded a professor and another student using a semi-automatic rifle. He held the building and its nearly 100 occupants hostage for seven hours before being apprehended by a SWAT team. He was sentenced to life in prison.[328][329]"
2003-09-24T04:00:00.000Z	"Cold Spring, Minnesota"	2	0	"Rocori High School shooting: 15-year-old John Jason McLaughlin, shot 15-year-old freshman Seth Bartell and 17-year-old senior Aaron Rollins at Rocori High School. Rollins was killed immediately, and Bartell died from his wounds sixteen days later. McLaughlin was sentenced to life in prison with the chance of parole in 2038.[302]"
2004-02-02T05:00:00.000Z	"Washington, D.C."	1	0	"Thomas J. Boykin was acquitted of the murder of 17-year-old James Richardson, a football player at Ballou High School in Southeast Washington.[330]"
2004-02-09T05:00:00.000Z	"East Greenbush, New York"	0	1	"Jon W. Romano in East Greenbush, New York fired two rounds from a shotgun, wounding one teacher. He was tackled by the assistant principal and charged with one count of attempted murder.[331]"
2004-05-07T04:00:00.000Z	"Randallstown, Maryland"	0	4	"Two students were charged with a school shooting that arose from a dispute after a basketball game at Randallstown High School. Four persons were injured, two seriously. One student was paralyzed from the waist down.[332]"
2005-02-08T05:00:00.000Z	"Chicago, Illinois"	0	1	An 18-year-old student at Bowen High School was shot in the leg as she left the school around 2:30 p.m.[333]
2005-03-02T05:00:00.000Z	"Dover, Tennessee"	1	0	"14-year-old Jason Clinard, killed his bus driver, 47-year-old Joyce Gregory, as she stopped to pick him up. Gregory had earlier reported Clinard for using snuff on the school bus. Clinard was given a life sentence.[334]"
2005-03-21T05:00:00.000Z	"Red Lake, Minnesota"	10	7	"Red Lake shootings: 16-year-old student Jeffrey Weise, killed his grandfather and grandfather's companion at their home, where he had been living, at the Red Lake Indian Reservation. He drove to Red Lake Senior High School. Armed with his grandfather's police weapons, Weise killed five students, one teacher, and one security guard, wounding seven others, before committing suicide.[335]"
2005-09-13T04:00:00.000Z	"Chicago, Illinois"	0	1	"At Harlan Community Academy High School, a fight broke out between two 15-year-old boys in the gymnasium. Christopher Huff took out a pistol, shooting the other youth in the leg. A police officer on duty at the school arrested the gunman. The suspected shooter was charged as an adult with aggravated battery with a firearm.[336]"
2005-11-08T05:00:00.000Z	"Jacksboro, Tennessee"	1	2	"Campbell County High School shooting: Inside the Campbell County High School office, 15-year-old Kenneth Bartley, shot the school principal, Gary Seale. He shot assistant principals Ken Bruce and Jim Pierce. Bruce later died from his wound. Bartley was sentenced to forty-five years in prison with chance of parole after twenty-nine years.[337][338][203]"
2006-02-23T05:00:00.000Z	"Roseburg, Oregon"	0	1	"14-year-old freshman Vincent Wayne Leodoro, shot student 16-year-old Joseph Monti, four times in the back with a semi-automatic handgun at Roseburg High School. Leodoro walked away from the school campus, and was confronted near a restaurant by six police officers. He threatened suicide but was persuaded to surrender.[339] He was found guilty of attempted murder and assault in July 2006, and will be held in prison until he turns twenty five years old.[340]"
2006-03-14T05:00:00.000Z	"Reno, Nevada"	0	2	"Pine Middle School shooting: In the hallway of Pine Middle School, 14-year-old James Scott Newman, injured two 14-year-old classmates, Alexander Rueda and Kenzie McKeon, with a revolver belonging to his parents. Two students received minor wounds. Newman was subdued by a physical education teacher. The youth was arrested and charged as an adult for attempted murder, use of a deadly weapon and use of a firearm by a minor.[341] He later pleaded guilty to charges of two counts of battery with a deadly weapon, and was sentenced as a juvenile. Newman was sentenced to house arrest until he completed two-hundred hours of community service.[342]"
2006-08-24T04:00:00.000Z	"Essex Junction, Vermont"	2	3	"Christopher Williams, 26, shot his girlfriend's mother, Linda Lambesis, 57 at her home and from there he went to Essex Elementary School where Andrea, his girlfriend, worked. After he arrived at the elementary school, which was not in session at the time, he shot and killed Mary Alicia Shanks, 56, and shot Mary Snedeker, 52, nonfatally. He left the school and allegedly shot Chad Johansen, 26 nonfatally. He then turned the gun on himself, but did not die as a result.[343]"
2006-08-30T04:00:00.000Z	"Hillsborough, North Carolina"	1	2	"After shooting and killing his father, teenager Alvaro Castillo went to his high school, where he wounded two students. He was reportedly obsessed with the Columbine shootings and had written an email to the current Columbine high school principal before committing his own crime.[344]"
2006-09-02T04:00:00.000Z	"Shepherdstown, West Virginia"	3	0	"49-year-old Douglas W. Pennington, killed himself and his two sons, 26-year-old Logan P. Pennington, 24-year-old Benjamin M. Pennington, during a visit to the campus of Shepherd University.[345][346]"
2006-09-17T04:00:00.000Z	"Pittsburgh, Pennsylvania"	0	5	"Five Duquesne basketball players were shot early Sunday morning during an apparent act of random violence on campus, leaving three hospitalized — two of them in critical condition.[347]"
2006-09-27T04:00:00.000Z	"Bailey, Colorado"	2	0	"Platte Canyon High School hostage crisis: 53-year-old drifter, Duane Roger Morrison, walked into Platte Canyon High School and took six girls hostage. He sexually assaulted them. As a SWAT team stormed the classroom, he killed 16-year-old Emily Keyes, then took his own life.[348]"
2006-09-29T04:00:00.000Z	"Cazenovia, Wisconsin"	1	0	"Weston High School shooting: At around 8 a.m., 15-year-old freshman, Eric Hainstock, entered Weston High School. He aimed a 20-gauge shotgun at social studies teacher, Chuck Keller, before it was wrestled from him by school custodian, Dave Thompson. Hainstock then shot 49-year-old high school principal, John Alfred Klang, with a .22 caliber revolver. Klang died later that afternoon.[349][350] Hainstock was charged and convicted of murder, and is serving a life sentence. He will be eligible for parole in 2037.[203][351]"
2006-10-02T04:00:00.000Z	"Nickel Mines, Pennsylvania"	6	3	"West Nickel Mines School shooting: 32-year-old milk truck driver, Charles Carl Roberts IV, killed five Amish girls and wounded five others before killing himself in an Amish school in the hamlet of Nickel Mines, in Bart Township, Lancaster County.[352]"
2006-10-09T04:00:00.000Z	"Joplin, Missouri"	0	0	"13-year-old student Thomas White fired one shot from a Mac-90 rifle at a hallway ceiling at Memorial Middle School. The gunshot struck a water pipe, and nobody was injured. He also tried repeatedly to shoot principal Stephen Gilbreth at near-point-blank range as Gilbreth ushered him out of the school. Joplin police say the attempt was foiled by an improperly seated ammunition clip in the rifle. The principal was not injured. White was tried as an adult on charges of assault and firearms possession, and in 2009 he was sentenced to ten years of prison.[353]"
2007-01-03T05:00:00.000Z	"Tacoma, Washington"	1	0	"18-year-old student Douglas S. Chanthabouly, killed 17-year-old Samnang Kok, in the hallways of Henry Foss High School following a personal disagreement. In 2009, Chanthabouly was sentenced to 23 years in prison on a charge of second-degree murder.[354]"
2007-03-07T05:00:00.000Z	"Compton, California"	0	1	"During an argument with several non-students and students, a student was shot in the elbow and wounded in the eating area at Centennial High School. The shooting occurred an hour after classes were dismissed, and students in after-school activities were sent home.[355]"
2007-04-16T04:00:00.000Z	"Blacksburg, Virginia"	33	23	"Virginia Tech shooting: 23-year-old student, Seung-Hui Cho, armed with 2 pistols, Glock 19 and Walther P22 killed thirty-two students and faculty members at Virginia Tech, and wounded another seventeen students and faculty members in two separate attacks before committing suicide. The first attack was on the second floor of Norris Hall where he shot a young girl and another young girl that came to help. He then changed his clothes, and made multiple videos stating that he ""had to do it for his brothers and sisters." He then made several pictures of him with hammers, large knifes, and guns. He then chained the doors shut and shot and killed 30 more students and staff. He also shot 17 more students and staff wounding them. 6 more students were also wounded from non gunshot injuries. He was described as extremely quiet and lonely. During the rampage he wore a black t-shirt, a russet vest, a backwards baseball cap, black military cargo pants, black boots, and grip gloves. The incident is the 3rd deadliest shooting by a lone gunman in mordern U.S. history and the deadliest school shooting in modern U.S. history."
2008-02-11T05:00:00.000Z	"Miami Gardens, Florida"	0	1	"43-year-old 11th grade algebra teacher, Sergio Miranda, was shot by 19-year-old Patrick Lively, outside Miami Carol City Senior High School during a robbery but was expected to survive.[356][357] In 2011, Lively received a life sentence.[358]"
2008-02-04T05:00:00.000Z	"Memphis, Tennessee"	0	1	"At Hamilton High School, a student shot a 16-year-old student in the leg during a classroom argument over rap music. The victim's injury was not life-threatening.[359]"
2008-02-08T05:00:00.000Z	"Baton Rouge, Louisiana"	3	0	"Latina Williams, a 23-year-old nursing student at Louisiana Technical College killed two classmates and herself in a second floor classroom.[360]"
2008-02-11T05:00:00.000Z	"Memphis, Tennessee"	0	1	"Following a feud that started off campus earlier in the week, a 19-year-old senior was shot by a 17-year-old sophomore during a gym class held in the cafeteria with about 75 other students at Mitchell High School, before handing the gun to a coach making no attempt to flee. The victim suffered at least two gunshot wounds and was in critical condition, the suspected shooter was in custody. ""He walked up to him, shot him, and made a statement to the coach that 'It's over now,' ", said principal, Daniel Ware.[361]"
2008-02-12T05:00:00.000Z	"Oxnard, California"	1	0	"Murder of Larry King: 14-year-old Brandon McInerney, shot 15-year-old Lawrence ""Larry" King, twice in the head in the computer laboratory of E.O. Green Junior High School. McInerney was apprehended in a nearby neighborhood. King, who was openly homosexual, died two days later. McInerney was initially charged with a hate crime, but that charge was dropped. McInerney pleaded guilty to second-degree murder and was sentenced to 21 years in prison.[362]"
2008-02-14T05:00:00.000Z	"DeKalb, Illinois"	6	21	"Northern Illinois University shooting: 27-year-old Steven Kazmierczak, shot multiple people with a shotgun in a classroom of Northern Illinois University, killing five and injuring 21, before taking his own life. Kazmierczak was not enrolled at the university, but had attended in the years prior to the attack.[363]"
2008-08-14T04:00:00.000Z	"Federal Way, Washington"	1	0	"26-year-old Omero Mendez was waiting at the Lakota Middle School campus to pick up his girlfriend's son. He was confronted by 16-year-old Luis F. Cosgaya-Alvarez and two of his friends, driving in an SUV. Cosgaya-Alvarez flashed gang signs at Mendez, and shot him once in the head. Mendez later died of his injuries. Cosgaya-Alvarez was arrested a few days later in Seattle and was charged with murder. Cosgaya-Alvarez pleaded guilty to murder and weapon enhancements, and was sentenced to eighteen years in prison.[364]"
2008-08-21T04:00:00.000Z	"Knoxville, Tennessee"	1	0	"At Central High School, 15-year-old Jamar Siler killed 15-year-old Ryan McDonald. In 2011, Siler was sentenced to thirty years in prison after pleading guilty to murder in a plea agreement.[147]"
2008-09-02T04:00:00.000Z	"Willoughby, Ohio"	0	0	"A 15-year-old student brought a handgun into South High School, and shot two rounds, one into the ceiling and one shattering a trophy case. The student then put the gun to his head. Then Assistant Principal Jeff Lyons talked the student out of doing any harm."
2008-10-16T04:00:00.000Z	"Detroit, Michigan"	1	3	"16-year-old Christopher Walker, was killed, and three other teenagers were seriously wounded during a drive-by shooting near Henry Ford High School, soon after classes let out. Three teenagers were arrested and charged in connection with the shooting. The shooter, 15-year-old William Morton, was sentenced to life without parole, and Devon Bell was sentenced to forty-two years of prison.[365]"
2008-10-26T04:00:00.000Z	"Conway, Arkansas"	2	1	"University of Central Arkansas shootings: Four young men fatally shot two students, 18-year-old Ryan Henderson, and 19-year-old Chavares Block, and wounded a 19-year-old campus visitor in the leg, outside the Arkansas Hall dormitory of University of Central Arkansas.[366]"
2008-11-12T05:00:00.000Z	"Fort Lauderdale, Florida"	1	0	"15-year-old Amanda Collette, was killed in the hallway at Dillard High School. The shooter, 15-year-old Teah Wimberly, was sentenced to twenty-five years to life on a first-degree murder charge.[367]"
2009-01-09T05:00:00.000Z	"Chicago, Illinois"	0	5	"After attendees were leaving a basketball game at Dunbar High School, a truck pulled over and someone inside fired shots at the crowd, wounding five people, three critically. 18-year-old Georgio Dukes, was arrested and charged a week later with five counts of felony aggravated battery with a firearm. Police believe that the attack was gang-related.[368]"
2009-04-26T04:00:00.000Z	"Hampton, Virginia"	0	3	"18-year-old Odane Greg Maye, a former student of Hampton University, followed a 43-year-old pizza delivery man into his former dormitory. Armed with three guns, Maye wounded the delivery man, then the dorm monitor. Lastly, Maye shot himself in a suicide attempt. He survived and was convicted of two charges of malicious wounding, two counts of using a gun in a felony; burglary; and shooting in an occupied building. He was sentenced to fourteen years of prison in November 2009, and was ordered by a judge to pay more than $62,000 in restitution to his victims for lost wages.[369]"
2009-05-18T04:00:00.000Z	"Cambridge, Massachusetts"	1	0	"20-year-old Jabrai Copney, 23-year-old Jason Aquino, and 19-year-old Blayn Jiggetts, of New York City, invited 21-year-old Justin Cosby, of Cambridge, into a Harvard College dormitory. After trying to rob him of a pound of marijuana, they shot him. Copney turned himself in four days later. Copney was convicted of murder. His partners pleaded guilty to armed robbery and manslaughter. His girlfriend, 21-year-old Brittany Smith, pleaded guilty to accessory after the fact, firearm possession, and misleading a grand jury.[370]"
2009-05-18T04:00:00.000Z	"Larose, Louisiana"	1	0	"15-year-old Larose-Cut Off Middle School student, Justin Doucet, carried his backpack to a restroom, where he put on camouflage clothes and took out a semi-automatic handgun before storming into a nearby classroom. He attempted to shoot a teacher, Jessica Plaisance, but the gun did not fire. He returned to the restroom and shot himself in the head, dying a week later of his wounds.[371][372]"
