date	location	deaths	injuries	description
1985-12-10T05:00:00.000Z	"Portland, Connecticut"	1	2	"After being suspended for refusing to take off his hat while at school, 13-year-old student Floyd Warmsley pulled out a firearm at Portland Junior High School, shooting and wounding the 53-year-old school secretary Lynn Haddad, and killing 36-year-old janitor David Bangston.[195][196]"
1986-03-06T05:00:00.000Z	"Dolton, Illinois"	0	1	"At about 9:40 a.m., as 52-year-old math teacher Norma Cooper`s third-period algebra class was beginning in a second-floor classroom in the C Building at Thornridge High School, she was shot in the shoulder by a freshman student, with a large-caliber handgun, registered to the youth`s father, a security guard. He is charged with attempted murder, unlawful use of a weapon and aggravated battery. The freshman, a resident of Harvey, was enrolled in the class and apparently had recently received poor grades.[197]"
1986-04-29T04:00:00.000Z	"Senath, Missouri"	1	0	"A new student, 16-year-old Ritchie Overman, killed studious 15-year-old Leslie Lynn Wyatt, using a 20-gauge shotgun, in front of twenty-six ""totally horrified" science class students and teacher Sheila Adams, at Senath-Hornersville High School.[198][199]"
1986-05-09T04:00:00.000Z	"Fayetteville, North Carolina"	0	3	A 17-year-old student shot three classmates at Pine Forest High School with a .25-caliber handgun wounding them. One student was critically injured and treated for a neck wound.[200]
1986-05-16T04:00:00.000Z	"Cokeville, Wyoming"	2	74	"Cokeville Elementary School hostage crisis: 43-year-old former town marshal David Young, and his 47-year-old wife, Doris Young, took 136 children and eighteen adults hostage at Cokeville Elementary School.[147][201][202]"
1986-12-04T05:00:00.000Z	"Lewistown, Montana"	1	3	"14-year-old Kristofer Hans intended to shoot his French teacher at Fergus High School, for a failing grade. Instead, Henrietta Smith, who was substituting for LaVonne Simonfy, was shot in the face and died.[203] Hans fired several other shots as he fled, wounding vice principal John Moffatt,[204] and two students.[161] He then ran about a mile to his home, where he was arrested after the police surrounded his house. A classmate said Hans had repeatedly threatened to kill Ms. Simonfy, saying, ""I'm going to blow Simonfy's head off."[205] He was charged as an adult, convicted and sentenced to 206 years in prison.[147][206]"
1987-02-04T05:00:00.000Z	"Northridge, California"	2	0	"35-year-old associate professor of Computer Science Djamshid (Amir) Asgari was confronted in the Engineering Building of California State University, Northridge by 25-year-old graduate student Fawwaz Abdin. Abdin was angry about a low grade Asgari had given him a year earlier, which caused him to be put on academic probation. After Asgari refused to change his grade, Abdin shot him twice, then himself. Asgari later died at the Northridge Hospital.[207]"
1987-03-02T05:00:00.000Z	"De Kalb, Missouri"	2	0	"After constant teasing about his weight, 12-year-old honors student Nathan Ferris killed a 13-year-old classmate, Timothy Perrin, then turned the gun on himself.[147][182][208]"
1987-04-16T04:00:00.000Z	"Detroit, Michigan"	1	2	"Murray-Wright High School second shooting: A ninth-grade student at Murray-Wright High School killed 17-year-old Chester Jackson, a student athlete, and wounded 17-year-old Damon Matthews, and 18-year-old Tomeka Turner.[209]"
1987-09-28T04:00:00.000Z	"Lansing, Illinois"	0	1	"After being kicked off the soccer team for smoking on school grounds, 16-year-old student Blake Docter, of Illiana Christian High School wounded 44-year-old John Hoogewerf in the chest, the teacher who had reported him for smoking.[210]"
1987-12-16T05:00:00.000Z	"Katy, Texas"	1	0	"After being refused a date from his classmate, 15 year-old Ramesh Guzman Tumalad shot and killed himself with a .357 Magnum revolver before 23 of his fellow freshman Algebra students at Mayde Creek High School. The evening prior to the shooting, the boy discussed committing suicide to the girl after she informed school administration of his obsession with her.[211]"
1988-02-11T05:00:00.000Z	"Largo, Florida"	1	2	"Pinellas Park_High shooting: 15-year-old students, Jason Harless and Jason McCoy, took stolen .38-caliber revolvers to Pinellas Park High School. Harless shot two assistant principals and a student-teacher inside the school's cafeteria. 53-year-old Richard Allen died from his injuries, Nancy Blackwelder and intern Joseph Bloznalis were wounded.[147][182][212]"
1988-05-20T04:00:00.000Z	"Winnetka, Illinois"	1	5	"30-year-old Laurie Dann, killed 8-year-old Nick Corwin, inside Hubbard Woods School. Five additional students were wounded. Dann later committed suicide after taking hostages in a nearby home.[147][182][213]"
1988-07-10T04:00:00.000Z	"Milwaukee, Wisconsin"	0	1	"25-year-old Robin Jenkins, was shot in the elbow after a basketball game turned violent about 7:45 p.m.at Siefert Elementary School. A 28-year-old man was taken into custody the following day.[214]"
1988-09-26T04:00:00.000Z	"Greenwood, South Carolina"	2	9	"Oakland Elementary School shooting: 19-year-old James William Wilson entered Oakland Elementary School and started firing shots in the cafeteria. Two students were wounded and a first-grade teacher. After reloading his gun in a girls' restroom, he was confronted by physical education teacher, Kat Finkbeiner, who tried to stop him; she was wounded twice. He then entered a third-grade classroom and shot toward the students, killing 8-year-olds Shequila Tawoon Bradley and Tequila Maria Thomas, and wounding five others.[147][182][215]"
1988-11-22T05:00:00.000Z	"Abilene, Texas"	0	1	"16-year-old student Mason Staggs shot Cooper High School teacher, Rick Maloney in the face with a pistol, severely injuring the teacher. Staggs left the school and went fishing.[216]"
1988-12-16T05:00:00.000Z	"Virginia Beach, Virginia"	1	1	"At Atlantic Shores Christian School, 16-year-old student Nicholas Elliott shot two teachers with a Mac-10 9-millimeter machine pistol, killing 41-year-old Karen Farley, and critically wounding 37-year-old Sam Marino, then began firing on a classroom full of students before the gun jammed and any students were hit.[182][217][218]"
1989-01-17T05:00:00.000Z	"Stockton, California"	6	32	"Stockton schoolyard shooting: 24-year-old Patrick Edward Purdy fatally shot five children and wounded 32 others at the Cleveland Elementary School, before taking his own life. The victims were children of refugees from Southeast Asia. Purdy had a history of violence, alcoholism and drug addiction, and criminality.[218][219]"
1989-02-10T05:00:00.000Z	"Kearns, Utah"	0	0	"At Thomas Jefferson Junior High School, a 12-year-old boy fired a handgun at a vice principal, William Crumbaugh. No one was injured.[220]"
1989-12-05T05:00:00.000Z	"McKeesport, Pennsylvania"	1	1	"While riding the school bus, 16-year-old Serra Catholic High School student, Robert Butler, shot 16-year-old schoolmate, Adam Ference, in the back of the head before fatally shooting himself.[221] Ference was in critical condition but survived.[222]"
1990-03-27T05:00:00.000Z	"Brooklyn, New York"	0	1	"A black youth was taunted with racial slurs by three white youths in the stairwell of a public school in the Bensonhurst area of Brooklyn. The 14-year-old was then shot and slightly wounded, because he had acted as peacemaker when the same boys had clashed with another black teen the month before.[223]"
1990-09-11T04:00:00.000Z	"San Antonio, Texas"	0	3	"3 students were wounded when gunfire broke out at Sam Houston High School. The incident took place at 11:55 a.m. and was gang related. 17-year-old John Campbell was wounded in the right foot, 18-year-old Larry Johnson was wounded in the right thigh and calf, and a 16-year-old received a chest wound. 18-year-old Kenneth Wolford, and two other male students were arrested and charged.[224]"
1991-02-06T05:00:00.000Z	"Donna, Texas"	1	0	15-year-old Raul Calvo fatally shot himself while playing Russian roulette inside a biology classroom at Donna High School.[225]
1991-04-23T04:00:00.000Z	"Compton, California"	1	0	"A teenager aimed and fired a handgun at a security guard who had chased him and three friends off the grounds of Ralph J. Bunche Middle School. He instead killed 11-year-old Alejandro Vargas, a bystander and student at the school.[226]"
1991-09-18T04:00:00.000Z	"Crosby, Texas"	1	0	"17-year-old Arthur Jermel Jack, was killed by 15-year-old LaKeeta Cadoree, in the cafeteria at Crosby High School.[227]"
1991-11-01T05:00:00.000Z	"Iowa City, Iowa"	6	1	"University of Iowa shooting: 28-year-old former graduate student, Gang Lu, killed four members of University of Iowa's faculty and a research student, and seriously wounded another student. 47-year-old professor of physics and astronomy, Christoph K. Goertz, 45-year-old associate professor of physics and astronomy, Robert Alan Smith, 44-year-old chairman of the physics and astronomy department, Dwight R. Nicholson, 56-year-old associate vice president for academic affairs, Dr. Theresa Anne Cleary, shot in the head and died the following day, and 27-year-old research investigator in physics and astronomy, Dr. Shan Linhua. 23-year-old Miya Rodolfo-Sioson, Dr. Cleary's temporary student receptionist in the grievance office, survived but was left paralyzed from the neck down. Lu then shot himself in the head, he died shortly after police arrived.[228][229][230][231]"
1991-11-25T05:00:00.000Z	"Brooklyn, New York"	1	0	"Thomas Jefferson High School shooting: During an argument between two teens, a stray bullet killed a third, uninvolved 16-year-old student. In 1992, 14-year-old shooter Jason Bentley, was sentenced to three to nine years in prison.[218]"
1991-12-12T05:00:00.000Z	"Kent, Ohio"	1	0	"51-year-old custodian, John Frazier, was killed outside a campus auditorium of Kent State University.[232]"
1992-01-29T05:00:00.000Z	"Kent, Ohio"	0	1	"26-year-old graduate student, Sarah Smith, was wounded in the chest as she was waiting for her husband to pick her up at Kent State University.[233]"
1992-04-23T04:00:00.000Z	"Bloomington, Indiana"	3	0	"Indiana University graduate student, Susan Clements, was shot to death in her dorm by a former boyfriend before he committed suicide. A friend that attempted to intervene, Steven Molen, was also shot and critically injured; he died several days later. Indiana University.[234]"
1992-02-26T05:00:00.000Z	"Brooklyn, New York"	2	0	"Thomas Jefferson High School second shooting: 15-year-old Kahlil Sumpter, killed fellow students, 16-year-old Tyrone Sinkler and 17-year-old Ian Moore, on the school's second-floor hallway.[235] In 1993, he was sentenced to between 6⅔ and twenty years in prison. He was released on parole in 1998.[218]"
1992-03-05T05:00:00.000Z	"Obetz, Ohio"	0	1	"Hamilton Middle School: Gordon W. Dye Jr. shot his bully Gregg Johnson in a with a .22-caliber pistol in the school cafeteria. Gregg was rushed to Children's Hospital in Columbus where doctors found the bullet and traced it's path. It had entered between Gregg's eyes and traveled the nasal sinuses where it shattered bones. Its trajectory was parallel to the bottom of the skull and was deflected by part of the skull base. This deflection sent the bullet on a downward path, to the adenoids.[236]"
1992-05-01T04:00:00.000Z	"Olivehurst, California"	4	10	"Lindhurst High School shooting: Former student, 20-year-old Eric Houston, killed three students and one teacher, and wounded nine other students and teacher before surrendering to police.[161][218]"
1992-09-11T04:00:00.000Z	"Amarillo, Texas"	0	7	"Following a pep rally, in a hallway near the activity center of Palo Duro High School, for the evening football match-up against Hereford High, 17 year old Randy Earl Matthews shot and wounded 7 students with a .22 caliber pistol. Matthews had attended the school for 9 days when the incident occurred and was believed to have been bullied at his previous school in Memphis Texas. Matthews was charged with one count attempted murder, five counts aggravated assault, and one count of unlawfully carrying a weapon onto school grounds. He served eight years.
[237]
"
1992-10-19T04:00:00.000Z	"The Bronx, New York"	0	3	Two 14-year-old girls and a 16-year-old boy were shot at outside a Bronx high school.[238]
1992-11-04T05:00:00.000Z	"Detroit, Michigan"	0	11	"11 students were hit by gunfire during a four-hour period in three separate school incidents, five were hospitalized. Six students at Finney High School were grazed by buckshot after three ski-masked gunmen opened fire in a crowded hallway. A 14-year-old was in custody for shooting three Foch Middle School students as they passed by the Marcus Garvey Academy. In the third incident, 16-year-old DeWayne Boyd was hit in the chest, when shots were fired at two Mumford High School students.[239]"
1993-01-06T05:00:00.000Z	"Brentwood, New York"	0	1	"Brentwood High School. Former student, Matthew Hunter, was shot by two gunmen during a basketball game between Brentwood High School and Sachem High School. The assault was over a dispute about the theft of a gold chain.[240]"
1993-01-18T05:00:00.000Z	"Grayson, Kentucky"	2	0	"East Carter High School shooting: 17-year-old Scott Pennington, a student at East Carter High School, fatally shot his 48-year-old English teacher, Deanna McDavid, and 52-year-old head custodian, Marvin Hicks.[241]"
1993-02-22T05:00:00.000Z	"Los Angeles, California"	1	0	"15-year-old Robert Heard, fatally shot 17-year-old Michael Shean Ensley in the corridor of the Reseda High School's science building.[242]"
1993-04-15T04:00:00.000Z	"Acushnet, Massachusetts"	1	0	44-year-old David Taber entered Ford Middle School and took three hostages. He killed school nurse Carol Day. He was found not guilty of the murder by reason of insanity.[218]
1993-05-14T04:00:00.000Z	"Irving, Texas"	1	0	"17-year-old Max Alexander Martinez, killed 17-year-old Jose Balderas, with a .38 caliber revolver in a hallway in Nimitz High School during a dispute over girls.[243][244]"
1993-05-24T04:00:00.000Z	"Pennsburg, Pennsylvania"	1	0	15-year-old student Jason Smith killed another student who had bullied him at Upper Perkiomen High School. He was charged as an adult and sentenced to between twelve and twenty-five years in prison.[218][245]
1993-09-17T04:00:00.000Z	"Sheridan, Wyoming"	1	4	"29-year-old Kevin Newman, wounded four students before killing himself at Central Junior High School.[246]"
1993-11-04T05:00:00.000Z	"New Britain, Connecticut"	1	0	"18-year-old Miguel DeJesus, was gunned down on the steps of New Britain High School.[247] Rival gang members, 24-year-old Maurice Flanagan and 23-year-old Thomas Mejia, were charged.[248]"
1993-12-01T05:00:00.000Z	"Wauwatosa, Wisconsin"	1	0	"Wauwatosa West High School shooting: 21-year-old former student, Leonard D. McDowell, shot 46-year-old associate principal, Dale Breitlow, three times with a revolver in a second-floor hallway of Wauwatosa West High School.[249] McDowell was found guilty of the murder and sane at the time of the shooting, he was sentenced to life in prison.[218] His sentence was upheld by the state Court of Appeals in April 1997.[250]"
1994-01-24T05:00:00.000Z	"Columbia, South Carolina"	1	0	"18-year-old Floyd Eugene Brown, shot fellow Eau Claire High School student, 17-year-old Earnest Dunlap, following an argument the week before. Brown was arrested shortly after at his home. A 16-year-old boy was also arrested for kicking Dunlap after the shooting.[251]"
1994-01-31T05:00:00.000Z	"Seattle, Washington"	1	0	"24-year-old Darrell Cloud, a former student at Whitman Middle School in North Seattle, killed 45-year-old Neal Summers, who had sexually abused Cloud since he was thirteen. Cloud served nine years in prison. He later received a $250,000 settlement in a civil suit against Seattle Schools, charging that Summers had not been adequately supervised.[252]"
1994-02-18T05:00:00.000Z	"Spartanburg, South Carolina"	0	1	"At around 10 p.m., 24-year-old Roosevelt Johnson was shot in the leg, after a basketball game at Spartanburg High School.[253]"
1994-03-01T05:00:00.000Z	"Boonville, Missouri"	2	0	"33-year-old Dante D. Hayes, a hunter and ex-convict, killed 58-year-old Richard Vancena, a cafeteria manager, and 33-year-old Robin Michelle Coleman, a cook, in the mess hall of Kemper Military School and College. He was drunk and looking for his wife Anna Hayes with whom he had a fight the night before. No students were harmed.[254]"
1994-04-12T04:00:00.000Z	"Butte, Montana"	1	0	"10-year-old Jason Osmanson, teased because his parents have AIDS, killed an 11-year-old student on the playground of Margaret Leary Elementary School. Osmanson was sent to a private residential treatment center.[218][244]"
1994-04-21T04:00:00.000Z	"Nashville, Tennessee"	1	0	"14-year-old Jeremy Bryant, killed 13-year-old Terrence Murray, in music class at J.T. Moore Middle School.[255]"
1994-10-12T04:00:00.000Z	"Greensboro, North Carolina"	1	1	"After being suspended for smoking, 16-year-old Nicholas Atkinson, returned to Grimsley High School with a 9 mm pistol. After wounding assistant principal, Bill Whites, Atkinson took his own life.[161][256][257]"
1994-10-17T04:00:00.000Z	"Chicago, Illinois"	0	1	"A 16-year-old female student was shot in the thigh outside Hubbard High School when a teenage boy rode past on a bicycle and fired into a crowd. It is believed the shooting was meant for rival gang members, but the girl was hit instead. The boy lived in the neighborhood.[258]"
1994-11-07T05:00:00.000Z	"Wickliffe, Ohio"	1	4	"Wickliffe Middle School shooting: 37-year-old former student, Keith A. Ledeger, killed 41-year-old custodian, Pete Christopher, at Wickliffe Middle School, and wounded 47-year-old assistant principal, Jim Anderson, 47-year-old police officer, Thomas Schmidt, and 50-year-old teacher, Lowell Grimm, before being injured and taken into custody.[218][244][259]"
1994-12-14T05:00:00.000Z	"Albany, New York"	0	1	"Ralph J. Tortorici, 26, a military veteran and psychology major at the State University of New York at Albany held hostage a large lecture hall from 9:10 a.m. until 11:30 a.m. Tortorici, armed with a .270-caliber rifle with more than two dozen rounds of ammunition and a hunting knife, walked into the ancient history class of Hans Pohlsander, saying, ""Don't worry. Nobody move. You guys are getting held hostage." The standoff ended when Tortorici had his gun taken away by Jason McEnaney, a 19-year-old student. McEnaney was shot in the leg, groin, and abdomen in the exchange. Tortorici suffered from a well-document history of mental illness, argued during the hostage crisis that the government had implanted a control chip in his head during a procedure at Albany Medical Center, and ultimately committed suicide in 1999 in prison while serving a 15 1/2 year sentence.[260][261][262][263]"
1995-01-12T05:00:00.000Z	"Seattle, Washington"	0	2	A 15-year-old student at Garfield High School left school during the day and returned with his grandfather's handgun. He wounded two students.[264]
1995-09-29T04:00:00.000Z	"Tavares, Florida"	1	0	"14-year-old student Keith E. Johnson, killed 13-year-old Joey Summerall, at Tavares Middle School with a handgun that he had stolen from his neighbor's home. He was convicted and sentenced to life in prison without the possibility of parole.[265]"
1995-10-12T04:00:00.000Z	"Blackville, South Carolina"	2	1	"Blackville-Hilda High School shooting: Suspended student, 16-year-old Toby R. Sincino, killed 56-year-old math teacher, Phyllis Senn, and wounded 38-year-old math teacher, Johhnny Thompson, before committing suicide at Blackville-Hilda High School.[218][244][266][267]"
1995-11-15T05:00:00.000Z	"Lynnville, Tennessee"	2	1	"Richland High School shooting: 17-year-old James Rouse, killed a student and teacher at Richland High School and seriously wounded another teacher with a rifle.[218][266][268]"
1996-01-19T05:00:00.000Z	"Washington, D.C."	1	0	"Two masked gunmen killed 14-year-old Damion Blocker in a stairwell at Winston Education Center. 16-year-old shooter, Darrick Evans, was sentenced to 41 years to life in prison.[218]"
1996-02-02T05:00:00.000Z	"Moses Lake, Washington"	3	1	"Frontier Middle School shooting: 14-year-old Barry Loukaitis, killed a teacher and two students and wounded another student when he opened fire on his algebra class. Loukaitis was sentenced to life in prison.[268][269]"
1996-02-29T05:00:00.000Z	"St. Louis, Missouri"	1	1	"30-year-old Mark Boyd, hired 23-year-old Malik Nettles, to kill 15-year-old Kyunia Taylor, as she rode on a school bus bound for Beaumont High School. Taylor was pregnant with a child fathered by Boyd, a baby girl was delivered by emergency caesarean section, but died 23 days later. The bus driver was also shot, he survived.[270]"
1996-08-15T04:00:00.000Z	"San Diego, California"	3	0	"San Diego State University shooting: At San Diego State University, 36-year-old graduate student, Frederick Martin Davidson, killed three professors, 32-year-old Chen Liang, 44-year-old D. Preston Lowrey III, and 36-year-old Costas Lyrintzis, that he believed were involved in a conspiracy against him.[268][271][272] Davidson was sentenced to serve three life terms.[273]"
1996-09-17T04:00:00.000Z	"State College, Pennsylvania"	1	2	"19-year-old Jillian Robbins, killed one student and injured two outside Pennsylvania State University's HUB–Robeson Center.[268][274][275]"
1996-09-25T04:00:00.000Z	"Decatur, Georgia"	1	2	"16-year-old David Dubose Jr., killed English teacher, Horace Morgan, on the steps of Dekalb Alternative School. Dubose was found not guilty by reason of insanity and was committed indefinitely to a state mental hospital.[147]"
1996-10-09T04:00:00.000Z	"Sherwood, Arkansas"	1	0	"14-year-old Willis Ward Johnson, killed 20-year-old James Earl Routt, as they rode a school bus.[276]"
1997-01-27T05:00:00.000Z	"West Palm Beach, Florida"	1	0	"14-year-old Conniston Middle School student, Tronneal Mangum, fatally shot 14-year-old classmate, John Pierre Kamel, just minutes before school started, over a $40 debt.[277]"
1997-02-19T05:00:00.000Z	"Bethel, Alaska"	2	2	"Bethel Regional High School shooting: 16-year-old student, Evan Ramsey, killed Bethel Regional High School principal, Ron Edwards, and 15-year-old student, Joshua Palacios, and wounded two other students.[268][278]"
1997-10-01T04:00:00.000Z	"Pearl, Mississippi"	3	7	"Pearl High School shooting: 16-year-old Luke Woodham, murdered his 50-year-old mother, Mary, at home before killing his ex-girlfriend, 16-year-old student, Christina Menefee, and 17-year-old student, Lydia Kaye Dew, then wounding seven others at Pearl High School.[268][279][280][281]"
1997-10-15T04:00:00.000Z	"Palmetto, Florida"	0	1	"After an argument between them the day before, 13-year-old Brandon Hartsoe took a .38 revolver from his mother's dresser drawer and shot 13-year-old Lincoln Middle School classmate, Trent Murray, in the back causing serious injury, then continued to fire three more shots in the general area of other students.[282] Hartsoe was sentenced in 1998 to serve until his 18th birthday. His probation was set to end in October 2009.[283]"
1997-12-01T05:00:00.000Z	"West Paducah, Kentucky"	3	5	"Heath High School shooting: Three students were killed and five wounded by 14-year-old Michael Carneal, as they participated in a prayer circle. Carneal was sentenced to life in prison.[268]"
1997-12-15T05:00:00.000Z	"Stamps, Arkansas"	0	2	"Concealed in a wooded area on school grounds, 14-year-old Joseph ""Colt" Todd, wounded two students as they were entering Stamps High School.[268][284]"
1998-03-01T05:00:00.000Z	"Philadelphia, Pennsylvania"	1	3	"At around 4:15 p.m., gunfire broke out as a crowd streamed from the Palestra after a high school championship basketball game near the University of Pennsylvania. A 22-year-old man was shot in the back and killed, and a student working at the fine arts building was shot in the leg.[285]"
1998-03-24T05:00:00.000Z	"Craighead County, Arkansas"	5	10	"Westside Middle School shootings: 13-year-old Mitchell Johnson, and 11-year-old Andrew Golden, killed a teacher and four students, and wounded ten others, as Westside Middle School emptied during a fire alarm intentionally set off by Golden.[286][287]"
1998-04-24T04:00:00.000Z	"Edinboro, Pennsylvania"	1	3	"Parker Middle School dance shooting: 14-year-old student, Andrew Wurst, fatally shot 48-year-old teacher, John Gillette, and wounded two students and another teacher at an 8th grade graduation dance. He is serving a thirty to sixty-year sentence in a prison for young offenders.[287][288]"
1998-05-19T04:00:00.000Z	"Fayetteville, Tennessee"	1	0	"18-year-old Jacob Lee Davis, shot 18-year-old Robert Creson, at Lincoln County High School in a dispute over a girl.[289] Davis received a life sentence on July 29, 1999.[290]"
1998-05-21T04:00:00.000Z	"Springfield, Oregon"	4	25	"Thurston High School shooting: After killing his parents at home, 15-year-old Kip Kinkel, drove to Thurston High School, where he killed two students and wounded 25 others.[287] After pleading guilty, he was sentenced to 111 years of prison.[291]"
1998-06-15T04:00:00.000Z	"Richmond, Virginia"	0	2	"14-year-old student, Quinshawn Brooker, wounded 45-year-old basketball coach and history teacher, Gregory Carter, and 74-year-old Head Start volunteer, Eloise Wilson, in the hallway of Armstrong High School.[287][292]"
1998-12-10T05:00:00.000Z	"Detroit, Michigan"	1	0	"52-year-old Professor Andrzej Olbrot, was killed by 48-year-old graduate doctoral student, Wlodzimierz Dedecjusat, at Wayne State University.[293]"
